ID,Sentence,MOS_Complexity,MOS_Understandability,MOS_Lexical_difficulty
1047,Aber es gibt noch besondere Regeln für behinderte Menschen.,1.0,1.0,1.0
411,"Infolge des menschlichen Kohlenstoffdioxidausstoßes, der zu etwa einem Viertel von den Weltmeeren aufgenommen wird, stieg der Säuregrad der Ozeane seit Beginn der Industrialisierung um knapp 30 % an (Stand 2016).",3.166666667,3.5555555560000003,3.777777778
652,"Mit der Industrialisierung veränderte sich auch Menge und Zusammenstellung des Mülls, so dass in London erste Kehrichtöfen entstanden, später auch die ersten Deponien.",3.428571429,3.285714286,3.571428571
1048,Welche Regeln für die Rente von behinderten Menschen gibt es?.,1.0,1.0,1.0
439,"Die Alpengletscher beispielsweise schrumpften in den vergangenen 150 Jahren etwa um ein Drittel ihrer Fläche, ihr Volumen ging zwischen 1901 und 2011 um fast die Hälfte zurück.",3.8181818180000002,3.0909090910000003,3.3636363639999995
930,Des Weiteren soll es beratend tätig werden und den Kommissionspräsidenten wählen.,2.714285714,2.0,3.285714286
1076,Deshalb haben und entwickeln wir Angebote für sie.,1.0,1.0,1.0
774,"Wie zuvor schon das spanische Kolonialreich galt auch das Empire als „Reich, in dem die Sonne nie untergeht“.",2.0,2.6,3.1
710,"Seinem Biographen Martin Gilbert zufolge war der Vertrag, den Churchill mit der Zeitung aushandelte, „wahrscheinlich der günstigste Vertrag, den überhaupt ein Kriegsberichterstatter bis dahin abgeschlossen hatte“.",3.222222222,4.2,4.6
219,"In allen diesen Bereichen gibt es neben dem einfachen Wurf eines Würfels auch Gelegenheiten, bei denen mehrere Würfel gleichzeitig zu werfen sind.",3.4,3.4,3.9
331,In dieser Situation verlieren Männer mit niedrigem Einkommens- und Bildungsniveau besonders häufig den Kontakt zu ihren Kindern.,2.0,1.222222222,2.0
279,Laut Plinius dem Älteren wurden Spinnweben zur Versorgung von Schnitten im Gesicht verwendet.,3.666666667,3.666666667,3.666666667
682,"Mit seiner Weigerung, in Verhandlungen mit Hitler einzutreten, und mit seinen Reden stärkte er in den kritischen Monaten des Frühjahrs und Sommers 1940 den britischen Widerstandswillen.",3.4444444439999997,3.7,4.3
601,"Im Osten des Parks wurden 1937 am Two Medicine Lake +47 °C gemessen, südlich des Parks am Rogers Pass 1954 ?57 °C, die niedrigste Temperatur der Vereinigten Staaten außerhalb Alaskas.",2.888888889,2.555555556,2.375
512,"Die ältesten Anzeichen für Ozeane auf unserer Erde sind in Gesteinen vorhanden, die inzwischen ein Alter von 3,2 Milliarden Jahren erreicht haben.",3.2,2.7,3.7
229,"Als Zufallsgenerator eingesetzt, wird von einem Würfel üblicherweise eine Gleichverteilung der möglichen Ergebnisse erwartet.",4.0,3.666666667,4.875
99,"Um die ergonomischste Rückenhaltung zu erreichen, sollte die Sitzhaltung idealerweise so sein, dass die imaginäre Linie zwischen Schulterblatt und höchstem Punkt des Pedals senkrecht ist.",3.4666666669999997,3.0,3.6
316,In Deutschland werden Infrastrukturmaßnahmen in Kombination mit Änderungen der familienbezogenen Transferleistungen und der Besteuerung insbesondere als wesentlich für eine Verringerung der Kinder- und Familienarmut genannt.,4.090909091,3.833333333,4.25
308,"Es wird gesagt, die gegenwärtige Ausrichtung der Gesellschaft und ökonomische Zwänge hätten vielmehr zu einem Anwachsen des Konsums, zu längeren Arbeitszeiten und zu einer Abwertung des Lebensbereichs Familie geführt.",3.8,3.5333333330000003,4.692307692
256,Die Klinge ist zumeist aus nicht rostfreiem Kohlenstoffstahl gefertigt und hohl geschliffen.,3.6,3.25,3.25
1111,"Sie entscheiden, welcher Betreuer Ihnen helfen soll.",1.0,1.0,1.5
721,"Die Auszeichnung wird seit 1901 jedes Jahr am Todestag Alfred Nobels, dem 10 Dezember, in Oslo verliehen.",2.3,1.9,2.8
1052,Mit dem Ausweis haben Sie viele Vorteile.,1.0,1.0,1.0
811,"Mehr als 2,5 Millionen Soldaten dienten in den britischen Streitkräften, dazu kamen Tausende von Freiwilligen aus den Kolonien.",2.5,1.9,2.0
976,Martin Luther King Jr (* 15 Januar 1929 in Atlanta als Michael King Jr; † 4 April 1968 in Memphis) war ein US-amerikanischer Baptistenpastor und Bürgerrechtler.,1.0,1.0,1.0
927,Regelungen zu Organisation und Arbeitsweise enthält die Geschäftsordnung des Europäischen Parlaments.,3.333333333,3.333333333,3.777777778
10,"Der Aufbau ähnelt dem von Biomembranen, jedoch befindet sich bei Seifenblasen das Wasser innerhalb der Membran, nicht außerhalb.",3.4444444439999997,2.9,4.0
1040,Manchmal muss man einen neuen Beruf lernen.,1.0,1.0,1.0
989,Ursprünglich hieß Kings Vater Michael King und er selbst Michael King Jr.,1.5833333330000001,1.0,1.75
1110,Sie können mit dem Geld einen Betreuer bezahlen.,1.4444444440000002,1.0,1.5
162,Sie bekommen per Post eine Rechnung mit einem aufgedruckten Barcode.,1.0,1.0,1.0
996,Schon damals setzte er sich öffentlich für die Desegregation und auch für die Stärkung der USA als Nation ein.,2.4,1.5555555559999998,3.0
907,Sie kehrten entweder um oder schlossen sich der Aufstandsbewegung an.,3.6,3.6,4.6
299,"Angesichts der Veränderung der Altersstruktur und des Anstiegs der Lebenserwartung in vielen Ländern rückt inzwischen auch die Betreuung und Pflege älterer oder pflegebedürftiger Angehöriger stärker in den Mittelpunkt des Interesses, auch der Politik.",4.3,4.0,5.0
38,"Im Mittelalter wurde die Tradition auch in Europa wieder aufgenommen, mit den im Vergleich zu den Thermen allerdings bescheiden dimensionierten Badehäusern.",2.444444444,2.555555556,3.0
880,"Der Matrosenaufstand begann auf Schillig-Reede vor Wilhelmshaven, wo die deutsche Hochseeflotte in Erwartung der geplanten Seeschlacht vor Anker gegangen war.",3.3,3.9,4.4
307,"Im Gegenteil stellt eine Familie heute dem Arbeitsmarkt im Durchschnitt tendenziell deutlich mehr Stunden Arbeitszeit zur Verfügung, als sie es Mitte des 20 Jahrhunderts tat.",3.0,2.214285714,3.071428571
606,Im Zuge der Laramischen Gebirgsbildung bauten plattentektonische Vorgänge vor der nordamerikanischen Westküste Druck auf.,4.444444444,4.5,5.1
1038,Die Agentur für Arbeit hilft ihnen eine neue Arbeit zu finden.,1.4,1.266666667,1.466666667
402,"Hierzu werden derzeit drei verschiedene Modelle mit daraus folgenden Skalen angewendet, die um bis zu 0,12 Einheiten auseinander liegen.",3.0,2.8125,3.0625
551,"Solche Gebiete sind zunächst Gebieten vorzuziehen, in denen ein dichtes Gestein für die Konvektion erst erschlossen werden muss.",4.5,3.9,4.777777778
614,"Aus den Ablagerungen von Sanden, Tonen und den Kalkgehäusen von Zooplankton in einem Urmeer entstanden zunächst Gesteine wie Sandstein, Schiefer und Kalkstein.",4.5,4.6,5.777777778
984,King Senior hatte seinen Abschluss an einer Abendschule nachgeholt und war bereits vor der Geburt von King junior Vorsitzender der National Association for the Advancement of Colored People (NAACP – Nationale Gesellschaft zur Förderung farbiger Menschen) in Atlanta.,3.111111111,2.25,2.375
372,"Bei Einhaltung des Zwei-Grad-Ziels könnte die Rate weltweit auf 5,2 % reduziert werden.",2.555555556,2.25,2.666666667
509,"Mit der fortschreitenden Abkühlung erreichte der Wasserdampf zum ersten Mal in der Geschichte der Erde seinen Kondensationspunkt, so dass sich flüssiges Wasser bilden konnte.",3.166666667,2.75,3.25
271,"Doppelschneidige Rasiermesser kamen in Mittel- und Westeuropa, einschließlich der britischen Inseln, im 16 Jahrhundert v Chr in Gebrauch, einschneidige Rasiermesser dagegen ausschließlich in Skandinavien im 15 Jahrhundert v Chr.",3.25,2.166666667,3.166666667
152,Der Ablauf ist ähnlich wie beim Geldabheben.,1.8125,2.352941176,2.066666667
668,Er war zweimal Premierminister (1940–1945 sowie 1951–1955) und führte Großbritannien durch den Zweiten Weltkrieg.,1.222222222,1.0,1.0
264,"Die Klinge muss vor jeder Rasur auf einem Streichriemen abgeledert und in regelmäßigen Abständen nachgeschliffen werden, um die Schärfe der Schneide zu erhalten.",3.5,3.9,4.5
41,Die Bedeutung des Bades in verschiedenen Epochen war immer eng mit den jeweils herrschenden Vorstellungen von Hygiene verknüpft.,2.2,1.4444444440000002,2.333333333
1043,Manche Menschen können nicht alles alleine entscheiden.,1.0,1.0,1.0
88,"Die Französin Barbara Buatois fuhr mit einem vollverkleideten Liegerad am 19 Juli 2009 im US-amerikanischen Romeo eine Strecke von 84,02 km, womit sie als erste Frau eine Strecke von mehr als 80 km in einer Stunde mit einem Liegerad zurücklegte.",3.666666667,3.6,4.3
306,Diese Vorhersagen sind jedoch bisher nicht eingetreten.,1.8,2.266666667,2.357142857
433,Dieser Vorgang wird Gletscherschwund oder Gletscherschmelze genannt.,2.266666667,2.5333333330000003,2.5714285709999998
262,Zudem können mit einem Rasiermesser gründlichere Rasuren erzielt werden.,1.75,1.571428571,1.857142857
220,"Dabei können die Ergebnisse addiert werden (eine Waffe in einem Rollenspiel richtet soviel Schaden an, wie zwei Würfel zusammen anzeigen) oder als Ensemble betrachtet werden (bei vielen Brettspielen folgen besondere Aktionen, wenn mehrere Würfel die gleiche Zahl zeigen, bei einem sogenannten Pasch).",5.5,5.0,5.0
190,"Am 4 Mai 1887 wurde Berliner für seine Idee das US-Patent No372,786 erteilt; kurioserweise fast zeitgleich mit der Erteilung des Patents für Edisons Phonographen.",3.2,3.133333333,3.4666666669999997
434,"Gemeint ist damit ein längerfristiger Massenverlust der Gletscher und nicht die in Gebirgen und Hochlagen alljährlich im Frühling einsetzende Schneeschmelze, auch nicht grundsätzlich das Schmelzen im Zehrgebiet, das bei Gletschern, die sich im Gleichgewicht mit dem Klima befinden, im gleichen Maße wie der Massengewinn im Nährgebiet auftritt.",5.555555556,4.722222222,5.5
684,Trotz dieses militärischen Triumphs verlor er die Unterhauswahlen des Jahres 1945.,2.1,2.5,2.9
223,Dies soll das Wurfergebnis unabhängig von der ursprünglichen Lage der Würfel machen.,3.277777778,3.333333333,3.888888889
844,"Da dieser wirtschaftlich zufriedenstellend lief, beschlossen sie 1885 und mit Unterstützung der gesamten Familie, eine eigene Fabrik für elektrische Geräte (Elektrotechnische Fabrik J Einstein & Cie) ins Leben zu rufen.",4.0,3.5,4.0
681,"Als Premierminister Neville Chamberlain infolge der glücklosen alliierten Kriegführung zurücktreten musste, übernahm Winston Churchill am 10 Mai 1940 das Amt des Regierungschefs.",4.0,3.3,4.3
544,Zusammen mit der Wärmeleitfähigkeit ergibt sich die lokale Wärmestromdichte und global integriert eine Leistung von etwa 40 Terawatt.,3.6,3.3,3.8
520,"Die Sauerstoffkonzentration in der Atmosphäre stieg weiter an, so dass damit aerobes Leben auf der Erde möglich wurde.",2.0,1.6666666669999999,2.6
894,"Zuletzt zogen die Teilnehmer zur Arrestanstalt, um die verhafteten Matrosen zu befreien.",2.615384615,2.692307692,2.923076923
768,Die Verleihung des Preises an Institutionen wurde zum Teil ebenfalls heftig kritisiert.,2.2,1.6666666669999999,2.214285714
115,"Ein Geldautomat, Geldausgabeautomat (GAA), Bankautomat, Bankomat, Bancomat oder wie im Englischen ATM (Automated Teller Machine) ist ein technisches Gerät zur Bargeldabhebung in Selbstbedienung bei Geld- und Kreditinstituten vom eigenen Giro- oder Kreditkartenkonto (siehe auch Electronic Cash).",2.727272727,2.0,3.1818181819999998
138,"Für den barrierefreien Zugang verfügen einige GAA über größere Tasten und Displays sowie über einen Kopfhöreranschluss oder Lautsprecher zur Sprachausgabe, um Menschen mit einer Sehbehinderung die Bedienung zu erleichtern oder überhaupt erst möglich zu machen.",4.0,3.375,4.272727273
506,"Das Klima in dieser Zeit war daher nicht nur heiß, sondern auch sehr trocken.",1.0,1.0,1.0
69,Die Vorliebe für warme Bäder war in der griechischen Gesellschaft nicht ohne Kritik.,1.733333333,1.6666666669999999,2.066666667
482,Je nach zeitlicher Perspektive werden dabei Klimaverläufe über wenige Jahrzehnte bis hin zu einigen Hundert Millionen Jahren analysiert.,2.222222222,2.9,3.7
521,"Die Veränderung der Konzentration der Klimagase und ihrer Zusammensetzung veränderte zudem den Strahlungshaushalt der Erde und brachte den Treibhauseffekt in Gang, der die Erde seitdem erwärmt.",2.875,3.222222222,4.3
217,"Ein eher seltenes, komplett auf Würfel als Spielmaterial setzendes Spielprinzip ist das der Sammelwürfelspiele, bei denen man analog zu Sammelkartenspielen eine Vielzahl von Würfeln käuflich erwerben und taktisch einsetzen muss.",4.555555556,4.0,4.428571429
841,"Dort heiratete er 1876 Pauline Koch und lebte in der Bahnhofstraße B135, wo Albert Einstein am 14 März 1879 zur Welt kam.",1.0,1.0,1.0
129,Der Tresor ist in der Regel fest eingemauert oder auf andere Weise mit dem Boden oder der Wand armiert.,2.2,2.357142857,2.642857143
558,"Es gibt aber auch Hochenthalpiefelder, die einen rein plutonitischen oder strukturgeologischen Hintergrund haben.",3.5,3.2,4.0
953,Die Ausgestaltung und Fortführung des europäischen Integrationsprozesses bleibt auch unter den Bedingungen des Reformvertrags von Lissabon eine außerordentliche Bewährungsprobe.,4.090909091,3.642857143,4.3571428569999995
610,Durch diese spezielle Entstehung hebt sich die Lewis range im Osten ohne Vorgebirge aus der Ebene der Great Plains.,4.307692308,3.733333333,4.2
391,"Wenn sich die Erwärmung bei 3 °C gegenüber dem vorindustriellen Wert stabilisiert, wird eine Meeresspiegelerhöhung bis zum Jahr 2300 um 2,5–5,1 m prognostiziert.",3.1,2.9,3.8
5,"Wegen dieser leichten Vergänglichkeit wurde ,Seifenblase‘ zu einer Metapher für etwas, das zwar anziehend, aber dennoch inhalts- und gehaltlos ist.",4.428571429,4.0,4.214285714
809,Die Kriegserklärung Großbritanniens und seiner Alliierten an das Deutsche Reich zu Beginn des Ersten Weltkriegs zog auch die Kolonien und Dominions in den Konflikt hinein.,3.5555555560000003,2.285714286,3.428571429
559,Abhängig von den Druck- und Temperaturbedingungen können Hochenthalpie-Lagerstätten mehr dampf- oder mehr wasserdominiert sein.,3.1818181819999998,3.272727273,4.6363636360000005
456,Im Nährgebiet (Akkumulationsgebiet) bleibt zumindest ein Teil des Schnees auch während des Sommers erhalten und formt sich dann zu Gletschereis um.,2.375,3.625,3.8
572,"HDR-Verfahren befinden sich in den Pilotprojekten in Bad Urach (D), in Soultz-sous-Forêts im Elsass (F) und in Basel (CH) in der Erprobung.",3.4,3.3,4.2
751,Die Nominierungen müssen bis spätestens zum 1 Februar des betreffenden Jahres erfolgen Es gilt das Datum des Poststempels .,3.0,3.083333333,3.0
189,"Nach chemischer Härtung des Rußes war er in der Lage, auf galvanoplastischem Wege ein Zink-Positiv und von diesem ein Negativ der Platte anzufertigen, das als Stempel zur Pressung beliebig vieler Positive genutzt werden konnte – die Schallplatte war erfunden.",4.7,5.5,5.8888888889999995
929,"Demzufolge wird das Parlament gemeinsam mit dem Rat als Gesetzgeber tätig, übt gemeinsam mit ihm die Haushaltsbefugnisse aus und nimmt die politische Kontrolle wahr.",3.615384615,3.416666667,4.076923077
310,"Die Meinung, Vorschulkinder litten unter der Berufstätigkeit der Mutter, herrscht vor allem in den alten Bundesländern der Bundesrepublik Deutschland, und zwar stärker als in jedem anderen Land der EU.",3.5,2.75,3.125
377,"Würden die Meere kein Kohlendioxid lösen, läge die atmosphärische Konzentration von Kohlenstoffdioxid einer Untersuchung aus dem Jahre 2004 zufolge um 55 ppm höher, zum damaligen Zeitpunkt also statt bei 380 ppm bei wenigstens 435 ppm.",4.3,3.6,5.1111111110000005
242,"Allerdings können die Landewahrscheinlichkeiten neben der Geometrie noch von anderen Bedingungen abhängen, zum Beispiel von der Reibung zwischen Würfel und Unterlage oder – auch unbeabsichtigt – von der Wurftechnik.",4.0,3.375,4.375
840,Hermann Einstein übersiedelte mit seinen Brüdern 1869 nach Ulm.,1.7,1.7,2.6
550,Diese finden sich beispielsweise in Grabenbrüchen (in Deutschland der Oberrheingraben) oder in tiefen Sedimentbecken.,2.888888889,3.6,4.2
808,"Großbritannien schloss neue Allianzen: 1902 mit Japan, sowie mit den ehemaligen Erzfeinden Frankreich (entente cordiale) 1904 und Russland 1907 (Triple Entente, Vertrag von Sankt Petersburg).",2.888888889,2.444444444,2.888888889
248,"Beim Casinospiel Craps sowie von einigen Rollenspielern ist dies jedoch verpönt, da ungleichmäßige Abrundungen bestimmte Landeflächen bevorzugen könnten.",3.3,3.8,4.0
784,"Es verfügte seit dem 19 Jahrhundert für viele Jahrzehnte über die mit Abstand größten Handels- und Kriegsflotten der Welt, galt als stärkste See- und Weltmacht und praktizierte bis etwa 1902 die Splendid isolation.",3.666666667,2.888888889,3.875
1034,Für Menschen mit Behinderung ist das sehr wichtig.,1.428571429,1.357142857,1.642857143
147,Große US-amerikanische Kriegsschiffe der US Navy haben ebenfalls Geldautomaten an Bord.,1.6666666669999999,1.125,2.0
800,"Während die Kolonien in Australien, Kanada, Neuseeland und Südafrika bereits im 19 und frühen 20 Jahrhundert als Dominions eine gewisse Eigenständigkeit erlangt hatten und diese danach stetig ausbauten, wurden die meisten Territorien des Britischen Weltreichs in der zweiten Hälfte des 20 Jahrhunderts im Zuge der Dekolonisation zu unabhängigen Staaten.",3.9411764710000003,3.2,3.357142857
1049,"Welche Rechte haben behinderte Menschen, wenn sie nicht mehr arbeiten?.",1.0,1.0,1.0
794,"Wirtschaftliche und politische Spannungen mit dem Deutschen Reich gehören zu den wichtigsten Ursachen des Ersten Weltkriegs, in dem Großbritannien in hohem Maße auf die Unterstützung durch seine Kolonien angewiesen war.",4.428571429,3.428571429,3.666666667
188,"Er konstruierte ein Gerät, das die Schallwellen nicht wie bei Edisons Höhenschrift-Phonographen in vertikaler, durch Auf-und-ab-Bewegung des Schneidstichels entstehender Modulation speicherte, sondern die Rille horizontal auslenkte; die mechanischen Schwingungen ließ er eine Stahlnadel schneckenförmig in eine dick mit Ruß überzogene Glasplatte einritzen.",5.7,5.6,6.2
170,"Die Signale sind in einer vom Rand der Platte spiralförmig nach innen verlaufenden Rille gespeichert, deren Flanken die Schallschwingung des gespeicherten Signals abbilden.",3.777777778,4.5,4.8
314,"Bei dieser gesellschaftlichen und politischen Debatte geht es immer auch um die Folgen der Modelle für die Gesellschaft, etwa um ökonomische Auswirkungen.",2.4,1.4444444440000002,2.9
663,"Das trifft besonders auf die in der Elektro- und Elektronikindustrie häufig verwendeten Seltenen Erden zu, die früher mit den weggeworfenen Geräten auf dem Müll landeten.",3.333333333,3.1,3.777777778
321,"Auch wenn einzelne Aufgaben an andere Personen oder Institutionen delegiert werden, liege die Aufgabe der Organisation der Haus- und Familienarbeit meist bei der Frau.",2.5,1.230769231,2.0
1115,Sie können das Budget bekommen.,1.0,1.0,1.0
474,"Dadurch nimmt die Gletscherfläche im Zehrgebiet, dort ist die Ablation am höchsten, zu.",4.0,4.222222222,4.8888888889999995
347,"Einige Veränderungen der Umwelt, die Menschen und Ökosysteme gemeinsam betreffen, sind schon wahrzunehmen.",3.222222222,2.375,3.625
592,Im Süden verlaufen die Bahnlinie der Great Northern Railway und der US Highway US 2 auf oder nahe der Parkgrenze.,2.6,2.5,3.125
839,"Auf den Grabsteinen des Buchauer jüdischen Friedhofs sind noch heute die Namen vieler Verwandter Einsteins zu finden; so unter anderem auch der des letzten Juden Buchaus, Siegbert Einstein, eines Großneffen des Physikers, der das KZ Theresienstadt überlebt hatte und nach dem Zweiten Weltkrieg zeitweise zweiter Bürgermeister der Stadt Buchau war.",4.466666667,3.666666667,4.615384615
866,Sie führte am 9 November 1918 in Berlin zur Ausrufung der Republik und zur Machtübernahme der Mehrheitssozialisten unter Friedrich Ebert.,2.2,2.9,3.2
370,"Werden keine Maßnahmen zur Bekämpfung des Klimawandels getroffen, sind weltweit 16 % aller Arten vom Aussterben bedroht, wie eine 2015 in Science erschienene Übersichtsarbeit ergab.",3.9090909089999997,3.3636363639999995,4.454545455
871,"Weitere Versuche zur Gründung von Räterepubliken, etwa in Bayern, blieben ebenfalls erfolglos.",3.285714286,3.357142857,3.571428571
807,"Das Deutsche Reich hatte einen rasanten Aufstieg hinter sich, sowohl militärisch als auch wirtschaftlich, und galt nun als wahrscheinlichster Gegner in einem künftigen Krieg.",3.3,2.8,3.2
966,"Die Schweiz und Norwegen (nach neuerlichem Negativvotum der Bürger) blieben außen vor, sodass die Europäische Union nun 15 Mitglieder umfasste.",2.2,2.1,2.9
134,Heutzutage sind neben einem Standard-PC auch PC-typische Betriebssysteme im Einsatz.,2.0,2.5,3.0
1097,Das Haus hat viele Einzel-Zimmer.,1.0,1.0,1.0
979,"Wesentlich durch Kings Einsatz und Wirkkraft ist das Civil Rights Movement zu einer Massenbewegung geworden, die schließlich erreicht hat, dass die Rassentrennung gesetzlich aufgehoben und das uneingeschränkte Wahlrecht für die schwarze Bevölkerung der US-Südstaaten eingeführt wurde.",4.8,3.7,4.8
499,"Einen Zeitrahmen von mehreren Hundert Millionen Jahren umfasst hingegen die Temperaturbestimmung mithilfe der Sauerstoff-Isotope 18O/16O, für die sich besonders fossile Korallen, Foraminiferen und Süßwassersedimente eignen.",4.0,3.9,4.1
260,Seit einigen Jahren finden Rasiermesser jedoch auch zunehmend im Privatbereich wieder eine wachsende Verwendung.,2.7,3.0,4.1
580,Der Glacier-Nationalpark ist seit 1976 ein Biosphärenreservat.,2.666666667,2.166666667,2.5
463,"Die Erwärmung ist mit zunehmender Nähe zu den Polen (siehe Polare Verstärkung) und mit steigender Höhe in Gebirgen (man spricht vom elevation dependent warming, dt höhenabhängige Erwärmung) stärker ausgeprägt.",3.6,3.133333333,3.4
661,"Ausgehend von Altpapier-Wiederverwendung wurden zunehmend Technologien erarbeitet, die die Wiederaufbereitung aller Arten von Altstoffen wirtschaftlich machen, wodurch Abfall zu einem bedeutenden Wirtschaftsgut wurde: Geprägt wurde dafür der Ausdruck Sekundärrohstoff.",4.75,4.0,4.538461538
600,"Der Westen unterliegt dem maritimen Einfluss des Pazifischen Ozeans mit gemäßigten Temperaturen und hohen Niederschlägen, während die Ostseite dem kontinentalen Klima zugehörig ist, das durch extreme jahreszeitliche Temperaturunterschiede und die für Nordamerika typischen Blizzards aus nördlichen Richtungen geprägt ist.",3.875,4.2,4.6
44,Die Wasserversorgung erfolgte über Brunnen.,1.4444444440000002,1.4444444440000002,2.0
507,"So gab es noch keine Meere, Niederschläge oder sonstiges flüssiges Wasser auf der Erde, und die Zusammensetzung der reduzierenden Uratmosphäre unterschied sich stark von der heutigen Erdatmosphäre.",4.2,3.333333333,4.777777778
15,"Zudem erfolgt im Laufe des Auslaufprozesses eine Anreicherung von Seifenfilm-stabilisierenden Tensidmolekülen im unteren Bereich der Seifenblase, sodass deren obere Region infolge des relativen Mangels von an die Oberfläche adsorbierten Tensidmolekülen zusätzlich destabilisiert wird.",5.7,5.2,6.0
405,"Nach einer Zusammenfassung der britischen Royal Society weist das Oberflächenwasser der Meere heute bis in eine Tiefe von 50 m typischerweise pH-Werte zwischen 7,9 und 8,25 auf, mit einem Durchschnittswert von 8,08.",3.3,2.2,3.3
491,"Bereits im 19 Jahrhundert wurde anhand von geologischen Klimazeugen wie Trogtälern, Grundmoränen oder Gletscherschliffen eine lange währende Eiszeit mit großräumigen Vergletscherungen (damals oft „Weltwinter“ genannt) sowohl in Europa als auch auf anderen Kontinenten direkt nachgewiesen.",4.8,5.0,6.1111111110000005
127,Die Bezahlmöglichkeit per Karte und einen ähnlichen Aufbau sowie ähnliche Sicherheitsproblematik wie ein Geldautomat besitzen Fahrkartenautomaten und andere Selbstbedienungsautomaten.,3.928571429,2.928571429,3.428571429
546,"Aufgrund der Wärmekapazität des Gesteins, und der damit verbundenen Menge der gespeicherten Wärme kann aber bei ausreichend großem Volumen die Abkühlung innerhalb der Nutzungsdauer gering bleiben und die Erdwärmenutzung somit nachhaltig sein.",5.0,4.4,5.666666667
672,"Nach einer Laufbahn als Offizier und Kriegsberichterstatter zog er 1901 als Abgeordneter ins Unterhaus ein, dem er über 60 Jahre lang angehören sollte.",4.0,3.375,4.0
641,Nach der Abtrennung und Entsorgung der Spaltprodukte können die restlichen Bestandteile des Kernbrennstoffs jedoch wieder zur Produktion neuer Brennelemente genutzt werden.,4.0,4.1,5.222222222
691,Churchills Großvater väterlicherseits gehörte als Duke of Marlborough dem britischen Hochadel an.,3.333333333,3.166666667,3.5
454,"Entscheidend für das Fortbestehen eines Gletschers ist seine Massenbilanz, die Differenz von Akkumulation (wie Schneefall, Ablagerung von Triebschnee und Lawinen, Kondensation von atmosphärischem Wasserdampf und Anfrieren von Regenwasser) und Ablation (Schmelze, Sublimation sowie Abbruch von Lawinen).",5.0,4.0,5.6
55,"Ein bestimmtes Bauschema scheint es nicht gegeben zu haben, man findet Räume mit meist 10 bis 22 Wannen oder Sitzwannen sowohl in rechteckiger (zum Beispiel in Olympia) als auch kreisbogenförmiger Anordnung (zum Beispiel in Gortyn, Gela und Megara Hyblaea).",3.6,4.2,4.3
468,"Kryokonit ist ein dunkler biogener Oberflächenstaub auf Schnee und Eis, der durch Winde in der Atmosphäre über weite Strecken transportiert wird und gewöhnlich auf Gletschern weltweit zu beobachten ist.",4.6,3.0909090910000003,3.6363636360000005
150,Zur Geldabhebung steckt der Kunde seine Karte in das Kartenlesegerät des Automaten und gibt seine (nur ihm bekannte) Geheimzahl (PIN) ein.,1.7,1.0,2.0
1102,"Wenn Sie im Alltag viel selbst machen können, können Sie auch in einer Außen-Wohngruppe leben.",1.5,1.5,1.375
617,Die jüngeren Gesteine aus Quartär und Kreide sind nur im Osten des Parks aufgeschlossen und bestehen aus Sand- und Schluffstein.,4.222222222,3.7,4.777777778
