ID,Sentence,MOS_Complexity,MOS_Understandability,MOS_Lexical_difficulty
155,"Über einen Geldautomaten mit der so genannten „Cash Recycling-Funktion“ wird das eingezahlte Geld geprüft, gebucht und wieder an nachfolgende Kunden ausbezahlt, wodurch sich der Aufwand für das Wiederbefüllen reduziert.",3.111111111,2.444444444,3.222222222
594,"In die beiden Nationalforste ist die nur durch die Bahn und die Straße vom Park getrennte Great Bear Wilderness eingelagert, ein Wilderness Area und damit die strengste Klasse von Naturschutzgebieten der Vereinigten Staaten.",3.0,3.0,3.222222222
822,Auch zur Quantenphysik leistete er wesentliche Beiträge.,3.222222222,2.9444444439999997,3.5
204,Dieses Symbol gilt dann als Ergebnis des Wurfes.,1.714285714,1.571428571,1.571428571
1095,Bei den Ausflügen sind immer nette Betreuer dabei.,1.8,2.0,3.0
980,Wegen seines Engagements für soziale Gerechtigkeit erhielt er 1964 den Friedensnobelpreis.,2.555555556,2.555555556,2.666666667
952,"Der durch das Ende des Ost-West-Konflikts bedingte tiefgreifende Wandlungsprozess hat zur Europäischen Union geführt, die mit dem Euro über eine gemeinsame Währung verfügt und nun auch die Staaten Mittel- und Osteuropas großteils einschließt.",4.3,3.1,4.3
169,Der seit dem Produktionsende der Grammophonplatten wesentlich geläufigere Begriff Schellackplatte grenzt diesen älteren Tonträger deutlich von der späteren Schallplatte aus Polyvinylchlorid ab.,4.222222222,3.571428571,4.666666667
683,"Außenpolitisch hatte er maßgeblichen Anteil am Zustandekommen der Anti-Hitler-Koalition zwischen Großbritannien, den USA und der Sowjetunion, die schließlich den Sieg über Deutschland und Japan errang.",4.0,3.5555555560000003,4.375
749,"Dies gilt besonders für den Friedensnobelpreis des Jahres 1973, als Henry Kissinger (USA) und Lê ??c Th? (Vietnam) (verzichtete auf den Preis) für das Friedensabkommen von 1973 in Vietnam ausgezeichnet wurden.",3.0,3.2,3.3
1061,Sie können eine Begleit-Person kostenlos mitnehmen.,1.571428571,1.166666667,1.857142857
193,November des gleichen Jahres vorgestellt; die frühesten zu Demonstrationszwecken angefertigten Zinkplatten hatten einen Durchmesser von 28 cm und bei etwa 30 min?1 eine Spieldauer von vier Minuten.,3.5555555560000003,3.4444444439999997,3.666666667
514,Der Wasserdampf kondensierte größtenteils und wurde als Wasser in Meeren und Seen gebunden.,3.333333333,3.0,3.4444444439999997
756,"Auch wurden viele Personen nicht mit dem Friedensnobelpreis gewürdigt, die ihn in der öffentlichen Wahrnehmung verdient hätten.",3.2,2.7,3.5
453,Der zunehmende Abfluss des Gletscherwassers führt zudem zum globalen Anstieg des Meeresspiegels und bedroht damit auch nicht unmittelbar im Einflussbereich von Gletschern lebende Menschen.,3.583333333,3.166666667,4.090909091
938,"In einer verbindlichen Erklärung aus dem Jahr 2010 haben sich die Parlamentarier mit der Kommission geeinigt, den geltenden europarechtlichen Vorschriften eine Interpretationshilfe zu geben, sodass in Zukunft auf Anstoß des Parlamentes die Kommission innerhalb von zwölf Monaten einen Gesetzentwurf vorlegen oder innerhalb von drei Monaten detailliert begründen muss, warum sie es nicht macht.",5.0,3.454545455,4.7
759,"Er wurde noch einige Male nominiert, wurde aber erst 1947 wieder in Betracht gezogen.",1.5,1.7777777780000001,2.777777778
83,Bei der Tour de France liegt die höchste Durchschnittsgeschwindigkeit eines Fahrers bei 41 km/h.,1.3,1.0,1.0
948,"Die Geschichte der Europäischen Union ist durch ein Geflecht konkurrierender Motive und Entwicklungstendenzen charakterisiert, die zu unterschiedlichen Zeitpunkten jeweils richtungsgebend auf die Entwicklung der Gemeinschaft eingewirkt haben.",4.8571428569999995,4.545454545,5.333333333
449,"Eine indirekte Wirkung des anthropogenen Klimawandels ist eine veränderte Verteilung von Niederschlägen, die ebenfalls die Massenbilanz von Gletschern beeinflussen kann.",3.666666667,3.714285714,4.285714286
535,"Heute stammt immer noch der größere Teil der Wärmeleistung aus dem radioaktiven Zerfall der langlebigeren Nuklide im Mantel, 235U und 238U, 232Th und 40K.",4.416666667,4.083333333,4.75
1112,Sie können mit dem bezahlten Betreuer zum Beispiel mit dem Bus fahren.,1.0,1.0,1.222222222
785,"Mehrere Siedlerkolonien, deren Bevölkerung vor allem durch den stetigen Zustrom von Auswanderern aus dem Mutterland zunahm, erhielten mit der Zeit mehr Autonomie und wurden zu Dominions erhoben.",4.8,4.8,5.2
1008,1948 schloss er das College mit einem Bachelor of Arts in Soziologie ab.,1.0,1.0,1.0
1046,"Wenn sie nicht mehr arbeiten, bekommen sie Geld von der Renten-Versicherung.",1.0,1.0,1.0
827,"In diesem Zusammenhang verstand er sich selbst als Pazifist, Sozialist und Zionist.",2.0,1.625,2.0
523,"Sie umfasst die in der Erde gespeicherte Energie, soweit sie entzogen und genutzt werden kann, und zählt zu den regenerativen Energien.",3.4,3.875,4.555555556
480,"Wenn sich ein Gletscher jedoch nicht zu einem neuen Gleichgewichtspunkt zurückziehen kann, befindet er sich im andauernden Ungleichgewicht und wird, sofern dieses Klima bestehen bleibt, komplett abschmelzen.",5.222222222,3.6,4.8
458,Getrennt sind diese beiden Gebiete durch die Gleichgewichtslinie.,2.7,2.7,2.6
311,"Studien belegen, dass die Frage, ob Kinder aus der Situation einen Nachteil oder auch einen Vorteil beziehen, nicht mit „Ja“ oder „Nein“ beantwortet werden kann: Die Wirkung der Berufstätigkeit auf das Kind hängt von Kontextfaktoren ab, insbesondere vom Berufskontext, von der Art der Verwendung von Zeit und Geld, von der Qualität der nichtelterlichen Kinderbetreuung und von der Zufriedenheit der Frau mit ihrer Rolle.",5.0,3.3636363639999995,4.166666667
732,"Das Komitee zur Vergabe des Friedensnobelpreises besteht aus fünf Personen, die vom norwegischen Parlament ausgewählt und ernannt werden.",3.111111111,2.777777778,2.888888889
1063,Das gilt nur für Züge von der Deutschen Bahn.,1.0,1.0,1.0
328,"In vielen Familien ist es zudem ökonomisch kaum möglich, dass sich ein Elternteil ganz der Haus- und Familienarbeit widmet – für eine zunehmende Zahl von Haushalten reicht Anfang des 21 Jahrhunderts ein Erwerbseinkommen allein nicht mehr zum Unterhalt einer Familie aus.",4.0,3.8,4.6
304,"Vielfach wurde vermutet, der technische Fortschritt des 20 Jahrhunderts werde mehrheitlich zur Verringerung der Arbeitszeit und zu einem Anwachsen der Freizeit führen.",4.0,3.833333333,4.6
98,"Dabei trägt naturgemäß der Fuß mit dem Kontaktpunkt Pedal den größten Teil des Körpergewichtes, und der Fuß ist von Natur auch dafür geschaffen, die Körperlast zu tragen.",3.0,2.7,3.6
33,"Der Begriff Badekultur oder Badewesen bezieht sich auf das Baden in warmem oder kaltem Wasser, das in erster Linie der Reinigung dient, aber auch der Förderung der Gesundheit und des Wohlbefindens.",3.0,3.2,3.6
823,"„Für seine Verdienste um die theoretische Physik, besonders für seine Entdeckung des Gesetzes des photoelektrischen Effekts“, erhielt er den Nobelpreis des Jahres 1921, der ihm 1922 überreicht wurde.",2.0,1.888888889,2.888888889
694,"In den 1950er Jahren lehnte er die erbliche Peerswürde ab, er wurde jedoch 1953 zum Ritter des Hosenbandordens geschlagen und damit als „Sir Winston Churchill“ in den nichterblichen Adelsstand erhoben.",4.6,3.8,5.0
408,"Aus der isotopischen Zusammensetzung von Borhydroxiden lässt sich bestimmen, dass der pH-Wert an der Meeresoberfläche vor etwa 21 Millionen Jahren etwa 7,4 ± 0,2 betrug, bis er vor ungefähr 7,5 Millionen Jahren auf den Wert von 8,2 ± 0,2 stieg.",3.2,3.8,4.2
1083,Wir helfen Ihnen bei der Arbeit.,1.0,1.0,1.0
1023,Zum Beispiel: Die Betriebe schaffen mehr Arbeits-Plätze für ältere Menschen.,1.533333333,1.153846154,1.6666666669999999
581,"Park und Region werden als Crown of the Continent (Krone des Kontinents) bezeichnet, das Crown of the Continent Ecosystem umfasst das Großökosystem der zentralen Rocky Mountains beidseits der Grenze weit über die Nationalparks hinaus.",3.285714286,2.0,3.428571429
27,"Zusätzlich verlangsamt die Seife die Verdunstung, so dass die Blasen länger halten.",3.111111111,3.222222222,3.666666667
46,"Aber nicht nur in diesem wohl öffentlichen Gebäude fand man Badeeinrichtungen, sondern auch in vielen Häusern der Stadt, die auf ein ausgeprägtes Hygienebedürfnis der Bewohner, vielleicht aber auch auf rituelle Waschungen schließen lassen.",4.181818182,3.272727273,4.0
235,"Der Bauplan ist genau dann ideal, wenn die Ruhepositionen des Würfels aufgrund seiner Symmetrie erst durch eine Beschriftung unterscheidbar werden.",4.0,3.8,3.7
63,300 Jahre später wurde das so genannte Hypokaustum zur Beheizung der Badeanlagen eingeführt.,2.352941176,2.7058823530000002,3.411764706
832,Zusätzlich zu seinem seit 1901 geltenden Schweizer Bürgerrecht erwarb er 1940 noch die Staatsbürgerschaft der Vereinigten Staaten.,3.2,1.7777777780000001,3.3
688,"Geboren wurde Winston Churchill in Blenheim Palace, dem Schloss seines Großvaters John Spencer-Churchill, des 7 Herzogs von Marlborough.",1.6666666669999999,1.5555555559999998,1.5
915,So müssen sich die Kandidaten für die EU-Kommission zunächst einer Anhörung im Europäischen Parlament stellen und ihre Eignung und Befähigung für das vorgeschlagene Amt unter Beweis stellen.,4.555555556,4.3,5.3
541,"Seit kurzem werden Zerfallsraten mittels Neutrinodetektoren auch direkt gemessen, in Übereinstimmung mit dem bekannten Ergebnis, allerdings noch sehr ungenau, ±40 %.",4.0,4.1,4.571428571
441,Letztere zeigen eindrucksvoll die unterschiedlichen Gletscherflächen von damals im Vergleich zu heute.,2.3,2.1,3.083333333
239,Nebenbei werden diese Formen wegen ihrer Symmetrie als besonders ästhetisch empfunden.,2.555555556,2.222222222,3.0
489,Die Klimageschichte ist auch für die Evolutionsgeschichte von Bedeutung.,1.7,1.125,1.6
665,"Besonders in Zeiten der Kriegswirtschaft wird auf Metallgegenstände des zivilen Gebrauches zurückgegriffen zwecks Sekundär-Rohstoffgewinnung zur Waffenproduktion, wie etwa 1940 unter dem Motto Metallspende des deutschen Volkes.",3.7,4.1,4.5
657,"Wiederverwendung war nur in Notzeiten, besonders während und nach Kriegen, ein Thema.",2.444444444,1.888888889,2.333333333
824,Seine theoretischen Arbeiten spielten – im Gegensatz zur verbreiteten Meinung – beim Bau der Atombombe und der Entwicklung der Kernenergie nur eine indirekte Rolle.,2.9375,2.4375,3.0625
442,"Ebenso zu beobachten ist ein Rückgang des Eises in den polaren Gebieten, wo es in den zurückliegenden Jahren vermehrt zum Abbrechen größerer Schelfeise gekommen ist.",4.444444444,4.0,4.777777778
94,"Dabei kommt es aber darauf an, eine gute Ergonomie für den gesamten Körper herzustellen.",3.1,2.9,2.8
478,"Auf eine Klimaerwärmung wie die globale Erwärmung oder eine Abnahme des Schneefalls, die zu einer negativen Massenbilanz führen, reagiert der Gletscher mit einem Rückgang.",3.777777778,3.666666667,4.0
695,"Seine Herkunft aus der britischen Hocharistokratie sicherte ihm in seiner Jugend die Aufnahme in renommierte Internate und eine Laufbahn als Armeeoffizier, obwohl seine Leistungen als Schüler eher mangelhaft waren.",3.538461538,2.769230769,4.0
1037,"Wenn behinderte Menschen eine Arbeit suchen, können sie Unterstützung bekommen.",1.307692308,1.428571429,1.8666666669999998
215,Auch hier kommen in erster Linie Sechsseiter zum Einsatz.,1.5555555559999998,2.3,2.333333333
571,Derzeit (2010) werden in Deutschland fast ausschließlich hydrothermale Systeme geplant.,2.2,1.5,3.3
185,"Er hatte sich mehrere Jahre lang mit dem Edison-Phonographen befasst und früher als Edison erkannt, dass die Zukunft der Tonaufzeichnung in erster Linie im Unterhaltungsbereich lag.",3.666666667,2.5714285709999998,3.857142857
26,"Seifenblasen mit reinem Wasser zu machen ist so schwierig, weil die Oberflächenspannung zu hoch ist, wodurch die Blase sofort zerplatzt.",3.333333333,2.777777778,3.4444444439999997
73,"Griechische Ärzte wandten bereits Hydrotherapie an, die sie von den Ägyptern übernommen hatten.",2.133333333,2.4,2.8
533,Kurzlebige Nuklide sorgten für ein Maximum der Manteltemperatur im mittleren Archaikum.,2.2,3.111111111,4.2
967,Mehr als die erst bei wenigen ins Bewusstsein gedrungene Unionsbürgerschaft hat – bereits vor dem Euro – der Abbau der Grenzkontrollen und Grenzanlagen zwischen den Bürgern der am Schengener Abkommen beteiligten Mitgliedstaaten ein Gefühl europäischer Zusammengehörigkeit wecken können.,5.3,4.4,5.1
1026,"Wenn ältere Menschen nicht mehr arbeiten, bekommen sie Rente.",1.6,1.0,1.0
1059,Mit diesem Ausweis können Sie kostenlos mit der Bahn fahren.,1.0,1.0,1.0
1093,Sie lernen neue Menschen kennen.,1.0,1.0,1.0
1041,"Rampen und Aufzüge sind wichtig für Menschen, die nicht mehr gut laufen können.",1.7,1.222222222,2.272727273
588,Auf diese Funktion als Scheitelpunkt Nordamerikas geht die Bezeichnung als Krone des Kontinents für den Park und die Region zurück.,3.5,3.1,3.4
18,Dadurch verlängert sich die Lebensdauer der Blase erheblich.,2.777777778,2.777777778,2.777777778
502,Ebenfalls sehr genaue geochronologische Daten liefern Zirkonkristalle aufgrund der darin enthaltenen Spuren radioaktiver Nuklide.,4.1,4.0,4.8
701,"Ohne schulischen Druck erwarb er sich nun auch eine profunde literarische Bildung und begann kurz darauf, selbst zu schreiben.",2.8,1.9333333330000002,2.1818181819999998
419,In der gesamten Hydrosphäre sind schätzungsweise 38 000 Gigatonnen (Gt) Kohlenstoff gespeichert.,2.857142857,2.5,3.285714286
1064,Der Freifahrt-Ausweis ist grün-rot.,1.0,1.0,1.0
81,Die Durchschnittsgeschwindigkeiten beim Fahrradfahren liegen für gewöhnlich bei 10 bis 25 km/h.,1.5555555559999998,1.0,2.444444444
574,Der Glacier-Nationalpark ist ein Nationalpark der Vereinigten Staaten im Hochgebirge der Rocky Mountains.,2.1,1.7,2.0
815,Im Falle Kanadas hatte die Schlacht bei Arras an der Westfront ähnliche Auswirkungen.,2.0,3.6,3.8
723,"Für die Vergabe ist, im Gegensatz zu den anderen Preiskategorien des Nobelpreises, keine schwedische Institution zuständig, sondern ein vom norwegischen Parlament bestimmtes fünfköpfiges Komitee, weswegen der Preis als einziger unter den Nobelpreisen nicht in Stockholm verliehen wird.",3.9,2.7,3.4444444439999997
429,"Es dauert hunderte bis tausende von Jahren, bis das aus der Atmosphäre aufgenommene anthropogene CO2 von den Ozeanen in die tiefsten Wasserschichten vorgedrungen und verteilt ist.",3.4,2.25,3.3
273,"Dabei hatten Rasiermesser, so Gnegel, „anscheinend zusätzlich eine religiöse oder kultische Funktion, denn sie fanden sich nur in einem Teil der Männergräber und standen offensichtlich nur Familienoberhäuptern oder Personen aristokratischer Herkunft zu“.",4.6,3.7,4.7
1100,In die Altstadt und zu den Werkstätten können Sie zu Fuß gehen.,1.0,1.0,1.125
70,"Der griechische Komödiendichter Aristophanes (um 450 bis 380 v Chr) zweifelt in Die Wolken daran, ob die sich in warmen Bädern verweichlichenden Griechen noch über die Manneskraft verfügten, die ihre Vorfahren in der Schlacht bei Marathon erfolgreich sein ließen.",3.9,3.8,4.3
971,"Denn unterdessen ist der „Schengen-Raum“ bedeutend angewachsen und soll sich auch künftig noch ausweiten; er schließt zwar noch immer nicht alle EU-Mitgliedstaaten ein, dafür aber auch bereits einige Nichtmitglieder (Norwegen, Island, Liechtenstein und die Schweiz).",4.75,4.0,4.8571428569999995
912,"Damit ist das Europäische Parlament nicht nur das einzige direkt gewählte Organ der Europäischen Union, sondern die einzige direkt gewählte supranationale Institution weltweit.",2.7,2.1,2.6
243,"Wenn man diese Bedingungen nicht vorab kennt oder wenn sie wechseln, dann ist ein genauer Ausgleich von vornherein unmöglich.",3.0,2.833333333,3.083333333
647,"Später waren es Schrott- und Lumpensammler, die sich um das Einsammeln, Sortieren und Weiterleiten von wiederverwertbarem Material kümmerten.",4.5,3.4,4.0
1075,Und dass sie auch am Arbeitsleben teilhaben können.,1.6,1.7,1.8
413,"Die Versauerung verläuft nach dem Fünften Sachstandsbericht des IPCC schneller als alle ähnlichen Versauerungen der vergangenen 65 Mio Jahre, eventuell der vergangenen 300 Mio Jahre.",5.0,4.444444444,5.055555556
753,Die Vergabe des Friedensnobelpreises ist besonders stark geprägt von Widersprüchen und ist entsprechend umstritten.,3.111111111,2.888888889,4.1111111110000005
920,"Dies bewirkt auch, dass die einzelnen Europa-Abgeordneten unabhängiger sind und mit Verhandlungsgeschick und Sachkenntnis größeren Einfluss auf die EU-Gesetzgebung haben, als es Abgeordneten nationaler Parlamente möglich ist.",4.7,4.9,5.3
35,"Die Ursprünge der europäischen Badekultur liegen in der Antike, als öffentliche Thermen auch eine wichtige soziale Funktion hatten.",1.7,1.3,1.6
297,"Diesem Diskurs liegt die Annahme zugrunde, dass die Eltern jeweils arbeiten wollen oder müssen, dass also die elterliche Berufstätigkeit subjektiv als wertvoll betrachtet wird, etwa weil sie Zufriedenheit gewährt, Sinn stiftet, die soziale Einbindung fördert, die wirtschaftliche Existenz bzw den Lebensstandard sichert oder weil mehrere dieser Gründe zutreffen.",5.071428571,4.1428571430000005,5.1428571430000005
51,"So schildert der achte Gesang beispielsweise, wie im Hause des Phaiakenkönigs Alkinoos Odysseus von den Haussklaven ein Bad zubereitet wird, bevor er sich an der Tafel seines Gastgebers niederlässt.",4.3,3.8,4.4
719,Der Friedensnobelpreis ist der wichtigste internationale Friedenspreis und eine Kategorie des von dem schwedischen Erfinder und Industriellen Alfred Nobel gestifteten Nobelpreises.,2.0,2.0,2.142857143
396,Das Meerwasser ist leicht basisch.,1.0,1.6875,1.357142857
183,Sie gelten als die ersten Schallplatten der Welt.,1.75,2.666666667,3.111111111
904,Soldaten und Arbeiter brachten die öffentlichen und militärischen Einrichtungen Kiels unter ihre Kontrolle.,1.6,1.4444444440000002,2.111111111
573,In Südost-Australien Cooperbecken ist seit 2001 ein kommerzielles Projekt im Gange (Firma Geodynamics Limited).,1.7777777780000001,2.5,3.0
440,"Direkt zu erkennen ist dies an Gemälden, Zeichnungen oder alten Fotografien.",1.7,1.25,2.2
111,Der Abstand zwischen beiden Händen (gemessen vom kleinen Finger der einen zum kleinen Finger der anderen Hand) sollte nur unwesentlich den Abstand der Schulterblätter übersteigen.,3.357142857,3.0,3.142857143
859,Es ist nicht zu verwechseln mit dem heutigen Luitpold-Gymnasium in München.,2.5,2.5,2.6
211,Viele Glücksspiele fallen in diese Kategorie.,1.5625,1.375,1.4375
1080,Sie können sich weiterbilden.,1.0,1.0,1.0
862,Ihr unmittelbarer Auslöser aber war der Flottenbefehl der Seekriegsleitung vom 24 Oktober 1918.,2.2,3.8,3.9
365,"Zwischen den globalen Temperaturen und der Biodiversität gibt es einen langfristigen Zusammenhang, der sich anhand von Fossilienfunden bis vor 520 Millionen Jahren feststellen lässt.",3.266666667,2.714285714,3.6
272,"Die Funktion dieser Messer ist laut Frank Gnegel, Autor einer Kulturgeschichte der Selbstrasur, „durch erhaltene Haarreste an den Schneiden eindeutig belegt“.",3.25,3.0,4.3
348,"Dazu gehören steigende Meeresspiegel, Gletscherschmelze oder statistisch signifikante Abweichungen vom gewöhnlichen Wettergeschehen (siehe unten).",3.9,3.7,4.4
121,"Gebräuchlich sind Bezeichnungen wie Cash Machine, Money Machine, Cashpoint, Cashline oder bauartbezogen Hole in the Wall („Loch in der Wand“).",2.666666667,2.125,2.625
726,"Der Preisträger des Friedensnobelpreises wird von einem fünfköpfigen Komitee, dem Norwegischen Nobelkomitee, ausgewählt.",2.2,2.2,2.8
384,"Zwischen 1901 und 2010 ist er um ca 1,7 cm pro Jahrzehnt gestiegen, wobei sich der Anstieg seit 1993 auf ca 3,2 cm pro Jahrzehnt erhöht hat.",3.375,2.3,2.7
337,Einige der Folgen sind im Klimawandelindex quantitativ zusammengefasst.,2.142857143,2.142857143,3.0
89,"Den aktuellen Stundenweltrekord der Männer hält der Schweizer Francesco Russo; er fuhr am 26 Juni 2016 im deutschen Klettwitz 92,43 km.",2.6,2.0,2.6
781,"Die Abspaltung der Dreizehn Kolonien nach dem Amerikanischen Unabhängigkeitskrieg (1775–1783) bedeutete zwar den Verlust der bevölkerungsreichsten Überseegebiete, doch wandte sich Großbritannien bald Afrika, Asien und Ozeanien zu.",3.875,3.0,4.3
891,"Nachdem die Polizei das Gewerkschaftshaus für den 2 November gesperrt hatte, versammelten sich am Folgetag mehrere tausend Matrosen und Vertreter der Arbeiter nachmittags auf dem Großen Exerzierplatz.",3.9,3.4,4.625
747,"Der Friedensnobelpreis kann auch an Personen oder Organisationen vergeben werden, die an einem noch laufenden Friedensprozess beteiligt sind, nicht nur für die abschließende Lösung eines Konflikts.",2.6,3.0,3.7
562,So werden negative Umwelteinwirkungen vermieden und gleichzeitig die Produktivität durch Aufrechterhalten eines höheren Druckniveaus in der Lagerstätte verbessert.,4.0,3.8,4.285714286
718,"Als Grund dafür gab er an, dass er in der Frage „Freihandel oder Schutzzoll“ die Haltung der Liberalen teile, die für den Freihandel eintraten.",3.5,2.8125,3.1875
100,"Um eine optimale Versorgung der Füße und eine möglichst geringe Belastung der Knie zu erreichen, sollte die Sattelhöhe so eingestellt werden, dass beim Treten der Pedale am tiefsten Punkt das Bein immer noch leicht angewinkelt ist.",4.6,3.7,5.0
86,"Der Geschwindigkeitsweltrekord, der in Bergabfahrt auf einem speziell angefertigten Mountainbike ohne Hilfsantrieb erreicht wurde, liegt bei 223,3 km/h.",3.3,2.7,2.9
744,Seitdem gab es keine Abgeordneten in diesem Ausschuss.,1.9,2.3,2.0
508,"Ungeachtet der Umweltverhältnisse kam zu diesem Zeitpunkt die Chemische Evolution in Gang, bei der sich organische Moleküle bildeten, die als Bausteine der Entstehung von Leben unerlässlich waren.",4.3,3.8,4.6
8,"Seifenblasen lösen auf physikalische Weise komplexe räumliche Probleme in der Mathematik, da sie im Gleichgewichtszustand die kleinste Oberfläche zwischen Punkten und Kanten bilden.",3.4444444439999997,2.888888889,3.75
66,"Es gibt keine Belege, dass Gymnasia vor der römischen Zeit ihren Nutzern bereits heißes Wasser anboten, obwohl dieses zur Entfernung des Öls und Schmutzes besser geeignet gewesen wäre.",3.7,3.625,4.5
860,"Die Novemberrevolution von 1918/19 führte in der Endphase des Ersten Weltkrieges zum Sturz der Monarchie im Deutschen Reich und zu dessen Umwandlung in eine parlamentarische Demokratie, die Weimarer Republik.",3.083333333,2.5,3.142857143
1058,Und es gibt den grün-roten Behinderten-Ausweis.,1.0,1.0,1.25
75,Er empfahl kalte Wassergüsse bei Rheuma und Gicht sowie kalte Wickel gegen Fieber.,3.071428571,2.615384615,3.5
849,Eine Hochbegabung war in seiner Jugend nicht abzusehen.,1.8,2.6,2.9
486,"Informationen über frühere Zeiträume galten lange als relativ unsicher, können jedoch zunehmend besser und genauer belegt werden.",2.142857143,2.777777778,3.333333333
584,"In der kanadischen Provinz British Columbia gibt es einen weiteren Nationalpark mit dem Namen Glacier, in Alaska liegt der Glacier-Bay-Nationalpark.",2.285714286,1.333333333,1.857142857
383,Als Folge der Erderwärmung erhöht sich der Meeresspiegel.,2.0,1.571428571,2.4285714290000002
945,Seit Inkrafttreten des Vertrags von Lissabon am 1.,2.6,3.4,3.4
760,Die Entscheidung fiel aber zugunsten von Quaker Peace and Social Witness aus.,3.4,3.4666666669999997,3.538461538
963,Mit dem negativen dänischen Plebiszit vom Juni 1992 geriet der Unionsvertrag in eine Ratifizierungskrise (die Franzosen votierten im Dezember 1992 nur zu 51 % positiv).,3.571428571,2.857142857,3.142857143
104,"Gleichfalls problematisch wird ein falscher Beckenwinkel auf dem Sattel für den gesamten Beckenbereich, da dieser Bereich stark mit Blut- und Nervenbahnen durchzogen ist, die auf der Innenseite der Oberschenkel liegen und die die unteren Gliedmaße zu versorgen haben.",5.2,3.9,5.2
153,"Der Kunde steckt seine Kundenkarte in den Automaten, danach öffnet sich ein Geldeingabeschacht, das Geld wird sofort auf Echtheit geprüft und dem Kunden auf seinem Konto gutgeschrieben (verbucht).",3.1,1.5,3.666666667
889,"Sie schickten Delegationen zu den Offizieren, die aber nicht angehört wurden.",3.1,2.6,2.555555556
776,Ebenso spielen die kolonialen Grenzziehungen bei heutigen regionalen Konflikten eine Rolle wie auch die weitere Verbundenheit der Länder im Commonwealth of Nations.,3.333333333,3.0,3.75
409,"Da der pH-Wert der Meere über den Henry-Koeffizienten direkt mit der Kohlenstoffdioxidkonzentration der Atmosphäre gekoppelt ist, lassen sich so auch Paläo-CO2-Konzentrationen bestimmen.",4.3636363639999995,4.181818182,5.545454545
406,"Die wichtigsten Ursachen für diese Differenz um 0,25 Einheiten sind die Temperatur des Wassers, der lokale Auftrieb von kohlenstoffdioxidreichem Tiefenwasser, sowie die biologische Produktivität, die dort, wo sie hoch ist, in Form von Meereslebewesen viel Kohlenstoffdioxid bindet und in tiefere Wasserschichten transportiert.",5.0,3.375,4.6
1070,Dazu müssen Sie einen Antrag an das Versorgungs-Amt schreiben.,1.5,1.5555555559999998,1.5
426,"Zwei Mechanismen sorgen dafür, dass es in noch größere Tiefen gelangt.",2.0,2.0,2.222222222
481,"Die Klimageschichte dokumentiert Entwicklung, Schwankungen und Auswirkungen des irdischen Klimas sowohl in geologischen Zeiträumen als auch in den Epochen der jüngeren Vergangenheit.",3.8,2.9,4.555555556
375,Der Ozean wirkt als große Kohlenstoffdioxidsenke und nimmt circa ein Drittel der durch menschliche Aktivitäten freigesetzten Menge Kohlenstoffdioxid auf.,3.266666667,2.6,2.8
197,Der zeittypischen Vorliebe für Gräzismen folgend nannte er es Grammophon (sinngemäß: „geschriebener Laut“).,4.25,4.166666667,4.416666667
848,"Gesichert ist dagegen, dass die Familie ein Gebäude im Hinterhof der Adlzreiterstraße 12 bewohnte, die heute zum Anwesen Lindwurmstraße 127 im Münchener Stadtteil Isarvorstadt gehört.",3.9,3.2,3.6
